conversation_id_str,created_at,favorite_count,full_text,id_str,image_url,in_reply_to_screen_name,lang,location,quote_count,reply_count,retweet_count,tweet_url,user_id_str,username
1.79071E+18,Wed May 15 16:38:08 +0000 2024,1,@ub_mfs Gausah kasian2. Mereka yg ribut soal ukt itu lagi memperjuangkan pendidikan mereka apalagi masuk PTN bukan hal yg mudah. Bayangin semua org punya pikiran kek lo nder dikit2 nyerah sm keadaan... gimana ya keadaan Indonesia beberapa th ke depan ,1.79078E+18,,ub_mfs,in,"Malang, Jawa Timur",0,0,0,https://x.com/jokikesayangan/status/1790783737808175448,1.52658E+18,jokikesayangan
1.79077E+18,Wed May 15 15:47:08 +0000 2024,1,GW BILANG JUGA APA. pilih lah calon presiden yg ngomongin masalah dunia pendidikan di indonesia ini yg tepat sasaran masalahnya dimana bukan asal koar koar biaya ukt univ negeri gratis!!!,1.79077E+18,,,in,,0,1,0,https://x.com/kokowinne/status/1790770903565164626,1.43962E+18,kokowinne
1.79074E+18,Wed May 15 15:13:40 +0000 2024,0,@agungwarancak Yes pendidikan tinggi Indonesia sdg ugal-ugalan dgn UKT yg meroket nggak keruan.Biang keroknya adalah proyek mjd PTNBH,1.79076E+18,,agungwarancak,in,"Jakarta Capital Region, Indone",0,0,0,https://x.com/rakhmat_haikal/status/1790762480240558195,99176889,rakhmat_haikal
1.79075E+18,Wed May 15 14:38:27 +0000 2024,0,in a balancing act it's true that higher education is not primary objective tapi kalau targetnya Indonesia Emas 2045 masa penjelasannya dirjen pendidikan tinggi begini doang bjir soal ukt mahal professor loh ini ,1.79075E+18,,,in,,0,0,0,https://x.com/juliaaandito/status/1790753617320055165,1422265194,juliaaandito
1.79073E+18,Wed May 15 13:54:19 +0000 2024,0,@elrchive bahkan di Indonesia sendiri udh banyak masyarakat yg minim literasi siswa/siswi yang putus sekolah sekarang buat org mengejar pendidikan tinggi pun kehalang ukt univ semoga ukt bisa pada turun deh kasian yg bener mau kuliah jdi di beratin ama biayany,1.79074E+18,,elrchive,in,fisip undip,0,1,0,https://x.com/piuwkiyoko/status/1790742509460853088,1.52868E+18,piuwkiyoko
1.79074E+18,Wed May 15 13:48:32 +0000 2024,6,ih aneh emang kalo orang kurang mampu buat bayar ukt yg harganya selangit itu gaboleh ttp kuliah ya? masa pendidikan di indonesia cm dikhususkan untuk org kaya sih ,1.79074E+18,,,in,,0,0,0,https://x.com/asheuji/status/1790741055991951475,1.15529E+18,asheuji
1.79074E+18,Wed May 15 13:35:29 +0000 2024,3,sudah jelas pendidikan itu kebutuhan primer. ternyata begini ya respon yang tepat terhadap fenomena kenaikan ukt. anak indonesia ga bisa kuliah sengaja dibuat jd tenaga kerja yg bisa disetir dan dibayar murah?,1.79074E+18,,,in,jakarta,0,2,0,https://x.com/neuroscist/status/1790737769633050691,1.63953E+18,neuroscist
1.79073E+18,Wed May 15 13:10:53 +0000 2024,10,UKT (Uang Kuliah Tunggal) memang sudah tidak masuk akal sudah jauh dari itung-itungan Matematika. UKT Brp? UMR Brp? Pendidikan itu HAK setiap Anak Pendidikan Bukan Privilege Kelompok Tertentu. GRATISKAN UKT‼️ Demi Masa Depan Anak-Anak Indonesia🇮🇩🇮🇩,1.79073E+18,,,in,"Surakarta,Indonesia",1,0,12,https://x.com/dr_ardi/status/1790731581046632940,353517338,dr_ardi
1.79073E+18,Wed May 15 13:02:32 +0000 2024,0,&lt;p&gt;Kementerian Pendidikan Kebudayaan Riset dan Teknologi (Kemendikbudristek) menyampaikan p&lt;span style= background-color: transparent; font-weight: var(--vz-body-font-weight); &gt;enambahan kelompok uang kuliah tunggal (UKT) ditujukan bagi mahasiswa yang https://t.co/EXFLuKaVdJ,1.79073E+18,,,in,"Jakarta Capital Region, Indone",0,0,0,https://x.com/validnewsid/status/1790729480316817510,8.74558E+17,validnewsid
1.79073E+18,Wed May 15 13:00:44 +0000 2024,0,Ramai karena UKT yang semakin mahal Kemendikbud : Pendidikan tinggi adalah kebutuhan tersier bukan termasuk wajib belajar. Tentu saja hal ini berlawanan dengan istilah yang digaungkan Menuju Indonesia Emas 2045.,1.79073E+18,,,in,"Kota Surabaya, Jawa Timur",0,0,1,https://x.com/Generasiosing/status/1790729024387576036,1.01727E+18,Generasiosing
1.79072E+18,Wed May 15 12:41:19 +0000 2024,1,nggak minta ukt gratis cuman minta diturunin. klo kuliah itu pilihan siapa yang gamau kuliah? dan bisa dapetin pendidikan tinggi tuh hak masyarakat (harusnya). kyk gini kok indonesia emas 2045 KOCAK,1.79072E+18,,,in,,0,0,0,https://x.com/jjlpitz/status/1790724138077974956,1.67446E+18,jjlpitz
1.79072E+18,Wed May 15 12:32:01 +0000 2024,0,Ancur ancur Indonesia. Pendidikan di bilang tersier. Ukt ra ngotak. Bpjs naik tp pelayanan tetap sama. Bosok negaraku Ya Allah Gusti. ,1.79072E+18,,,in,Perempuan/Wanita,0,0,0,https://x.com/RettaTeuk/status/1790721798264574179,597953336,RettaTeuk
1.7907E+18,Wed May 15 11:36:45 +0000 2024,0,Buat keluarga menegah ke bawah 1 orang berhasil ke pendidikan tinggi itu efeknya besar dan merembet. Katanya mau menuju indonesia emas 2045 masa respon ukt mahal kaya gitu. Bubar kata aing ma teh indonesia 2045,1.79071E+18,,nawillaaa,in,Bekasi,0,0,0,https://x.com/nawillaaa/status/1790707891428815132,9.11072E+17,nawillaaa
1.79071E+18,Wed May 15 11:27:51 +0000 2024,19,makin hari liat pendidikan di indonesia tuh sedih:(( ukt naik anak kipk salah sasaran banyak terjadi kekerasan seksual bullying rektornya gtu mentrinya gitu apalg presiden jawabnya template YNTKTS selama ngejabat kagetan mulu lebih ngurus IKN IKN noh makan uang haram,1.79071E+18,,,in,sm stan❌️,0,0,6,https://x.com/rrnebae/status/1790705650550616340,1.15138E+18,rrnebae
1.7907E+18,Wed May 15 11:18:53 +0000 2024,2,Dalam sejam sudah baca 3 berita buruk tentang negeri ini: 1. Respon kemendikbudristek tentang biaya ukt mahal. He said pendidikan tinggi itu tersier 2. Harga komoditas pertanian (jagung) anjlok 3. RUU penyiaran 4. Film horor KS sudah 2 jt penonton Rip indonesia emas 2045,1.7907E+18,,,in,Bekasi,0,0,0,https://x.com/nawillaaa/status/1790703396225511746,9.11072E+17,nawillaaa
1.7907E+18,Wed May 15 11:00:02 +0000 2024,6,[ UANG KULIAH MAKIN MAHAL PERGURUAN TINGGI MAKIN SULIT DIJANGKAU ] Kali ini #LembarFakta bahas soal biaya kuliah (UKT) di beberapa PTN yang naik dan akhirnya menyulitkan mahasiswa untuk mengakses pendidikan tinggi. Masa yang bisa kuliah cuma yang bisa bayar UKT tinggi aja?? https://t.co/SDvYhfdHxf,1.7907E+18,https://pbs.twimg.com/media/GNnHPeia4AAzgR6.jpg,,in,Indonesia,0,1,3,https://x.com/CakraWikara/status/1790698650232111182,8.57874E+17,CakraWikara
1.79061E+18,Wed May 15 05:21:37 +0000 2024,0,@jokikesayangan ih yaallah kak semoga rezekinya lancaar yaaa ini sebenernya masih bisa buat ukt cuman kan biaya hidup dan lain² belum ya hiks mirisnya pendidikan indonesia ini,1.79061E+18,,jokikesayangan,in,,0,0,0,https://x.com/vanilaraspberry/status/1790613487032656338,1.42716E+18,vanilaraspberry
1.79058E+18,Wed May 15 02:53:53 +0000 2024,0,*[SERUAN KONSOLIDASI UMUM]* Hidup Mahasiswa! Hidup Rakyat Indonesia! Menindak lanjut konsolidasi sebelumnya isu biaya pendidikan di Unsoed seperti kenaikan UKT &amp; IPI masih sangatlah kompleks. Banyak hal yang belum optimal dan wajib dibenahi oleh Unsoed. https://t.co/oIEgXX2Kk8,1.79058E+18,https://pbs.twimg.com/media/GNlnp8fakAAAaph.jpg,,in,Unsoed,0,1,2,https://x.com/BEM_Unsoed/status/1790576306352275616,297204645,BEM_Unsoed
1.79057E+18,Wed May 15 02:23:47 +0000 2024,0,Anjir knapa sii dunia pendidikan di Indonesia???!!! Biaya sekolah Mahal UKT MAHAL tapi gaji tenaga pengajarnya sedikit.. Calon guru dapatnya dikit juga. Katanya tujuan Negara ini mau mencerdaskan kehidupan bangsa tapi kok mau mengenyam pendidikan aja harus terkendala duit ,1.79057E+18,,,in,,0,0,0,https://x.com/AeriBee1/status/1790568729815978035,1.30859E+18,AeriBee1
1.79041E+18,Tue May 14 16:13:24 +0000 2024,0,Tentang Indonesia menuju negara maju sementara di satu sisi anak2 generasi bangsa ini yang berikutnya harus bayar mahal sekali untuk biaya pendidikan kuliah yaitu biaya UKT. Woy kalian harus tahu bahwa sekolah SD SMP SMA di seluruh negara ini gratis lho? Apakah kalian sudah,1.79042E+18,,semut_daun01,in,,0,1,0,https://x.com/semut_daun01/status/1790415123158544825,1.70964E+18,semut_daun01
1.79039E+18,Tue May 14 14:36:49 +0000 2024,34,Menuju Indonesia Emas 2045 tapi pendidikan masih sulit disentuh orang-orang dengan ekonomi menengah ke bawah. Terlebih lagi untuk orang tua mereka yang PNS golongan UKT yang didapat bisa sampai golongan paling akhir. #TurunkanUKTUB,1.79039E+18,,,in,CYBER – WRITING | He – Him,0,4,7,https://x.com/itsrdska/status/1790390817670271108,1.41246E+18,itsrdska
1.79037E+18,Tue May 14 13:06:11 +0000 2024,0,infrastruktur tarif tol naik pendidikan ukt dimahalin kesehatan bpjs diganti dan ga semua bs dicover blm isu2 pajak naik &amp; hak media/pers dibatasin ini gmn sih serius masih mau nahan pemerintah kyk gini indonesia guling guling 2025 kata gw sih,1.79037E+18,,,in,she/her,0,0,0,https://x.com/asteIlar/status/1790368010202685836,1.37866E+18,asteIlar
1.79034E+18,Tue May 14 11:32:13 +0000 2024,1,hidup di indonesia tuh bikin geram sendiri. pertama minima pendidikan terakhir di pekerjaan rata rata s1 tapi ak sering jg lihat s2. kedua Kipk sering banget salah target ketiga Ukt ga masuk akal. apalagi ini PTN terus gelar negeri itu apa? kl kaya gni mnding swasta kocak,1.79034E+18,,,in,personal account.,0,0,0,https://x.com/forlisz/status/1790344360648941697,1.50806E+18,forlisz
1.78996E+18,Mon May 13 10:16:38 +0000 2024,0,UKT Mahasiswa Sampai Komersialisasi Efek Desain Pendidikan Indonesia Tidak Matang? https://t.co/whGYxfrkgj,1.78996E+18,,,in,,0,0,0,https://x.com/RepelitaO/status/1789962951346078034,1.22543E+18,RepelitaO
1.78991E+18,Mon May 13 06:55:29 +0000 2024,0,UKT Mahasiswa sampai Komersialisasi Efek Desain Pendidikan Indonesia Tidak Matang? https://t.co/kMvNVncsH4 https://t.co/kMvNVncsH4,1.78991E+18,,,in,indonesia,0,0,0,https://x.com/posaktualcom/status/1789912331297710397,1.63663E+18,posaktualcom
1.7899E+18,Mon May 13 06:00:01 +0000 2024,2,UKT Mahasiswa Sampai Komersialisasi Efek Desain Pendidikan Indonesia Tidak Matang? https://t.co/q3jAcKX2QW,1.7899E+18,,,in,Indonesia,0,4,0,https://x.com/democrazymedia/status/1789898372087984260,1.2438E+18,democrazymedia
1.78982E+18,Mon May 13 00:48:31 +0000 2024,1,Hari Pendidikan Nasional 2 Mei sudah berlalu. Namun masih ada catatan kritis soal pendidikan tinggi di Indonesia seperti meroketnya UKT tantangan mutu pendidikan masalah program magang kritik Merdeka Belajar dan sebagainya.,1.78982E+18,,,in,"Jakarta, Indonesia",0,1,1,https://x.com/bebasdotid/status/1789819982194377067,3013290668,bebasdotid
1.78965E+18,Sun May 12 13:42:54 +0000 2024,0,Nilai UKT Melonjak Anggota Komisi X DPR RI Khawatir Akses Pendidikan Tinggi di Indonesia Sulit Dijangkau https://t.co/QqxNklETmG,1.78965E+18,,,in,"Kota Bandung, Jawa Barat",0,0,0,https://x.com/ayobacanews/status/1789652475227889877,1.64577E+18,ayobacanews
1.78953E+18,Sun May 12 13:27:10 +0000 2024,0,@BennyGabee @sayainiarman @bokulos_ @T0M5helby Anak indonesia paia klaperan?klo yg diterluar terdalm tertinggal gw percaya Mending danax buat pendidikan kesehatan usaha kreatif itu lebih bemanfaat UKT mahasiswa naik gimn tercapai indonesia emas 2045 yg ada indonesia cemas Program konyol,1.78965E+18,,BennyGabee,in,"Jakarta Selatan, DKI Jakarta",0,0,0,https://x.com/endokbulus/status/1789648512218722574,1.6101E+18,endokbulus
1.78949E+18,Sun May 12 03:10:00 +0000 2024,3,DIRJEN Pendidikan Tinggi Riset dan Teknologi Kemendikbudristek Abdul Haris menyebut penentuan besaran uang kuliah tunggal (UKT) harus dilakukan dengan mempertimbangkan kemampuan ekonomi mahasiswa orangtua atau pihak lain yang membiayai. https://t.co/l1oX57haKx,1.78949E+18,,,in,Jakarta - Indonesia,0,0,0,https://x.com/mediaindonesia/status/1789493198215377343,68930552,mediaindonesia
1.78856E+18,Thu May 09 13:04:01 +0000 2024,3,Amanat konstitusi kta dimana mencerdaskan kehidupan bangsa yg mnjadi tanggung jawab &amp; tujuan negara Indonesia patut dipertanyakan terhadap rasionalisasi melentingnya gol ukt hingga gol 12. Saya harap isu ini trs dikawal agar hak pendidikan didapat secara penuh oleh para maba‼️,1.78856E+18,,,in,fhub,0,0,1,https://x.com/unordinarykid/status/1788555524503699627,1.47243E+18,unordinarykid
1.78851E+18,Thu May 09 09:55:57 +0000 2024,1914,UKT Mahal ?? Emang masih penting ya pendidikan ? Bukan nya kalian lebih senang jadi orang Bodoh ? Agar pemimpin dzalim betah berkuasa di indonesia...,1.78851E+18,,,in,"Klaten, Jawa Tengah",11,38,496,https://x.com/Catatan_ali7/status/1788508197432725568,1.13331E+18,Catatan_ali7
1.78817E+18,Thu May 09 09:50:16 +0000 2024,1,@HisyamMochtar Brti rektor skrng di seluruh Indonesia dipilih pak jokowi ya? Trs hubungannya demo UKT sama kemaren ditawari pendidikan milih makanan ?,1.78851E+18,,HisyamMochtar,in,,0,0,0,https://x.com/yaawww/status/1788506766445305910,1391456684,yaawww
1.78849E+18,Thu May 09 09:00:00 +0000 2024,1,Kok jadi gini ya dunia pendidikan Indonesia #uangkuliahtunggal #ukt #usu #unri #unsoed #ugm #rektor #mahasiswa #infografis #pinterpolitik #politikindonesia #beritapolitik https://t.co/TYIt37pZ8l,1.78849E+18,https://pbs.twimg.com/media/GNGzpmda8AAeGcG.jpg,,in,"Jakarta, Indonesia",0,1,0,https://x.com/pinterpolitik/status/1788494115619156045,7.98771E+17,pinterpolitik
1.78842E+18,Thu May 09 04:23:08 +0000 2024,0,UKT PTN seluruh Indonesia naik 100% buset ini negara mau dibawa kemana orang jadi ga berani nanti buat pendidikan inilah efek PTN disuruh cari uang sendiri dampaknya ke mahasiswa aku 2017 UKT tertinggi aja 3jt sekarang udah 8 5jt di FISIP USU asli signifikan banget naiknya,1.78842E+18,,,in,,0,0,0,https://x.com/Yohaneshtg/status/1788424441741144402,1567893343,Yohaneshtg
1.78842E+18,Thu May 09 04:16:03 +0000 2024,0,UKT rataan tiba-tiba pada naik di seluruh PTN Indonesia dari yg masih normal sampai 30-50% bahkan sampai 100%. Dan gak ada solusinya sama sekali dari pusat sebagai penjamin pendidikan negara.....,1.78842E+18,,,in,,0,0,0,https://x.com/FahrulArdi17_/status/1788422656079085605,1.21907E+18,FahrulArdi17_
1.78817E+18,Thu May 09 03:14:31 +0000 2024,0,@CNNIndonesia UKT mahal = makin ga mampu rakyat untuk mengenyam pendidikan tinggi = makin bodoh rakyat nya = makin gampang dikendalikan.. Lalu selogan menuju indonesia emas 2045 itu untuk siapa..?,1.78841E+18,,CNNIndonesia,in,Wanokuni,0,0,0,https://x.com/dynotuyus/status/1788407171551768918,265396544,dynotuyus
1.78838E+18,Thu May 09 01:37:38 +0000 2024,9,Oh begini cara rezim PKI antek China penjajah menghina Rakyat Indonesia. 5 Mei 2024: Kado Hari Pendidikan Nasional: UKT Naik di Berbagai Kampus Negeri https://t.co/SD3E4BxtYV #KabinetGemoyPrabowo #KabinetGemoyPrabowo,1.78838E+18,,,in,,0,2,10,https://x.com/dancersejati07/status/1788382789123088628,1.60575E+18,dancersejati07
1.78837E+18,Thu May 09 00:54:04 +0000 2024,73,Oh begini cara rezim PKI antek China penjajah menghina Rakyat Indonesia. 5 Mei 2024: Kado Hari Pendidikan Nasional: UKT Naik di Berbagai Kampus Negeri https://t.co/cSbnnfZVqi @unjsecret #KabinetGemoyPrabowo #KabinetGemoyPrabowo,1.78837E+18,,,in,,2,2,59,https://x.com/MichelAdam7__/status/1788371828597231782,1.64731E+18,MichelAdam7__
1.78814E+18,Wed May 08 23:33:56 +0000 2024,645,@liaasister Ini baru permulaan tunggu aja 2-3 tahun lagi akan banyak mahasiswa putus kuliah karena gak sanggup bayar UKT. 2045 kualitas dan taraf pendidikan orang Indonesia akan berada di bawah Timor Leste.,1.78835E+18,,liaasister,in,"Jakarta, 🇮🇩",4,8,19,https://x.com/rajaonan/status/1788351660009365626,2177741178,rajaonan
1.78812E+18,Wed May 08 08:15:34 +0000 2024,0,Mahasiswa udah GERAH dgn UKT nya. Lom yg mau daftar mundur teratur. Bapak SUPI yg hebat...mau kah negara meng cover semua biaya pendidikan tinggi kita ? Bukan perut yg di isi menuju indonesia Emas https://t.co/6IVQLa7TGR,1.78812E+18,,,in,"Tangerang, Indonesia",0,0,0,https://x.com/DudungSuli5307/status/1788120544061305317,1.719E+18,DudungSuli5307
1.78805E+18,Wed May 08 03:45:03 +0000 2024,3,Otonomi perguruan tinggi negeri makin hari makin membuat biaya mahal pendidikan tinggi. Melambungnya besaran uang kuliah tunggal (UKT) memicu kritik tajam dari mahasiswa pelbagai kampus negeri di seluruh Indonesia. #KoranTempo https://t.co/9fRM0UlKYZ,1.78805E+18,https://pbs.twimg.com/media/GNBwPZyaIAICT0_.jpg,,in,Indonesia,1,1,1,https://x.com/tempodotco/status/1788052466401239521,18129942,tempodotco
1.78805E+18,Wed May 08 03:45:01 +0000 2024,39,Otonomi perguruan tinggi negeri makin hari makin membuat biaya mahal pendidikan tinggi. Melambungnya besaran uang kuliah tunggal (UKT) memicu kritik tajam dari mahasiswa pelbagai kampus negeri di seluruh Indonesia. #KoranTempo https://t.co/2zfdw6vVwB,1.78805E+18,https://pbs.twimg.com/media/GNBwPKQaIAEEmgb.jpg,,in,Indonesia,0,4,26,https://x.com/korantempo/status/1788052461217014003,20963426,korantempo
1.7878E+18,Tue May 07 11:19:43 +0000 2024,10,Sementara kita tahu pendidikan tinggi di Indonesia sangat tidak ramah untuk orang dengan kondisi kepepet dan punya tanggungan keluarga seperti Bima. - UKT mahal - Dana beasiswa pun sedikit.,1.7878E+18,,parlefeu,in,Yogyakarta,0,1,0,https://x.com/parlefeu/status/1787804500214067456,9.1277E+17,parlefeu
1.78762E+18,Mon May 06 23:17:49 +0000 2024,0,Kemunduran Indonesia. Untuk pendidikan saja mahal sekali. SPI dan UKT yang gak ngotak. Kalian bisa gak mengatasi ini di progam 100 hari kerja? Gak cuman urusan makan gratis saja. @prabowo @gibran_tweet,1.78762E+18,,,in,,0,0,0,https://x.com/IboeJari/status/1787622828097102193,1.30421E+18,IboeJari
1.78745E+18,Mon May 06 11:54:11 +0000 2024,57,Apa yang terjadi di Indonesia saat ini dengan UKT yang makin mahal dan yang tidak mampu bayar diminta mencari pinjol itulah yang dinamakan NEOLIBERALISME Pendidikan Pengamat Pendidikan: Konsep Pendidikan di Kelola dengan Mekanisme Pasar ... https://t.co/clfgRR2Gkd via @YouTube,1.78745E+18,,,in,Jakarta - Indonesia,0,1,24,https://x.com/icharis/status/1787450788425687187,69492528,icharis
1.78739E+18,Mon May 06 07:51:29 +0000 2024,0,ukt naik kalo umr kerja indo naik mah gapapa kalo engga ya sm aja nyekik rakyatnya katanya Indonesia emas masa generasi mudanya mau ngambil pendidikan dipersulit masalah biaya???,1.78739E+18,,,in,under name of earth,0,0,0,https://x.com/eleoena/status/1787389711058887076,1.31372E+18,eleoena
1.78718E+18,Sun May 05 18:01:31 +0000 2024,5,problem sistemik kampus di Indonesia kampus dengan budaya feodal kekurangan sdm pendidik kip yang tidak sesuai sasaran silabus pendidikan yang carut marut ukt yang naik secara extreme dan banyak lagi semangat untuk semua orang yang sedang dan akan menempuh pendidikan.,1.78718E+18,,,in,,0,0,1,https://x.com/ferdiptrm/status/1787180843221553421,1.1595E+18,ferdiptrm
1.7869E+18,Sun May 05 10:30:34 +0000 2024,0,@DgMakkulle @msaid_didu Ingin ku berkata kasar ttg pendidikan di Indonesia ini lbh tepat sy berkata kasar ke rezim ini : Aannnyyiiinnnggg sia. UKT utk anak guru tinggi orang gak mau jadi guru. Tukin dosen kecil orang gak mau jd dosen. UKT tinggi orang gak mau nuntut ilmu tinggi. SUEEEEEE,1.78707E+18,,DgMakkulle,in,"Depok, Jawa Barat",0,0,0,https://x.com/siujangedi/status/1787067356088541320,2328948373,siujangedi
1.78676E+18,Sun May 05 08:06:52 +0000 2024,1,@pakaipeci Universitas ternama d Indonesia UKT Reguler capai 162 JutaIni Pendidikan hanya untuk Kalangan Borjouis doank yaah Mas @pakaipeci ,1.78703E+18,,pakaipeci,in,"PKU, UPG, KDI, SRG,BNA.",0,1,0,https://x.com/annourcharity/status/1787031192853979356,1.46747E+18,annourcharity
1.78667E+18,Sat May 04 21:24:32 +0000 2024,0,@ferrykoto Innalillahi @ferrykoto otak dan hati sudah gak waras bahkan menuju membusuk cek kembali anggaran pendidikan 20 persen kalau anggaran sesuai dgn alokasi nya tidak mungkin UKT bisa naik tingggi. Pikir lagi....,1.78687E+18,,ferrykoto,in,Jakarta Capital Region,0,0,0,https://x.com/muhammaroke/status/1786869545107693602,87901651,muhammaroke
1.78663E+18,Sat May 04 12:20:35 +0000 2024,0,@msaid_didu Rakyat Indonesia itu butuh makan siang gratis terbukti pada Pilpres kemarin ooo urusan pendidikan ya yang miskin gak bole sarjana yg penting makan gratis kalau yang kaya UKT itu kecil sudah tak usah berdebat yang harus ditunggu makan siang gratis,1.78673E+18,,msaid_didu,in,,0,0,0,https://x.com/andialfians1/status/1786732653288517917,464293491,andialfians1
1.78667E+18,Sat May 04 10:28:05 +0000 2024,1,@msaid_didu Ristekdikti = Riset teknologi pendidikan tinggi. Itu mencakup dunia penelitian n dunia perguruan tinggi Jadi kalo pd protes knp indonesia minim inovasi ato knp org pinter pd out ya gegara minim dana penelitian dari pemsat Lalu perguruan tinggi mereka ngakalin dgn naikin UKT,1.7867E+18,,akubukanako,in,"DKI Jakarta, Indonesia",0,1,0,https://x.com/akubukanako/status/1786704342780952929,778692608,akubukanako
1.7867E+18,Sat May 04 10:24:44 +0000 2024,22,Apa penyebab biaya masuk dn UKT di PTN naik drastis thn ini ya? Ilmu mmg mahal tp negara berkewajiban mencerdaskan bangsa! Nadiem Makarim lo apa kerjaannya?? Turun lah ke lapangan cek. Keluar dari zona aman lo. Serius lah urusi pendidikan Indonesia.,1.7867E+18,,,in,"Tegal, Jawa Tengah",0,2,2,https://x.com/Abahpurwa1/status/1786703499163820471,1.50199E+18,Abahpurwa1
1.78635E+18,Fri May 03 13:19:07 +0000 2024,87,@ShofwanAlBanna *Hasbara is typing* - Sedih banget universitas terbaik di Indonesia ikut-ikutan - Pendidikan seharusnya netral - Pada gak pernah ke Gaza tapi sok tau - Kenapa enggak kaya gini waktu kasus .... - Mahal-mahal bayar kuliah.... - Masalah UKT enggak ada yang begini Yok dipilih,1.78638E+18,,ShofwanAlBanna,in,,0,5,10,https://x.com/antropolohis/status/1786384999559864758,97671645,antropolohis
1.78628E+18,Fri May 03 06:03:46 +0000 2024,11,Indonesia benar2 gawat adalah Pendidikan : (. Di TL saya bahas UKT selangit sama sejenis beasiswa kok ga kelar2. Jangan patah semangat untk mengejar Pendidikan tinggi bagi yang mau lanjutkan setelah lulus sekolah Selamat Pendidikan Nasional (lupa blm ucapkan kemarin :3),1.78628E+18,,,in,Indonesia,0,0,0,https://x.com/fatimah_rah11/status/1786275437293064694,1.17581E+18,fatimah_rah11
1.78618E+18,Thu May 02 23:31:16 +0000 2024,0,@Gerindra Pagi min Saya pusing sbg ortu. Biaya utk kuliah semakin mahal. Tolong sampaikan ke pak @prabowo hargai keinginan anak² Indonesia yg telah berjuang utk melanjutkan pendidikan tinggi. Langkah mereka terhenti didepan gerbang PTN hanya krn SPI dan UKT.,1.78618E+18,,Gerindra,in,,0,0,0,https://x.com/IboeJari/status/1786176661131813296,1.30421E+18,IboeJari
1.78607E+18,Thu May 02 16:14:12 +0000 2024,8,Halo guyss for maba² yang ingin coba beasiswa sangat amat worth it guyss benefitnya Free UKT Uang Saku Uang buku Asuransi Kesehatan dan lain lain yuk dicoba Beasiswa Pendidikan Indonesia. Boleh tanya² khusus skema BIM DN yaaa. Good luck https://t.co/W2cBvmcA2j,1.78607E+18,https://pbs.twimg.com/media/GMliLBkaQAAwC8x.jpg,,in,,0,12,1,https://x.com/audreyyyyy0zz/status/1786066670823612627,1.54867E+18,audreyyyyy0zz
1.78603E+18,Thu May 02 13:58:26 +0000 2024,0,Sama satu lagi menurutku jeleknya pendidikan Indonesia. Berapa banyak beasiswa untuk kelas menengah nanggung? Untuk lo yg gak mampu2 banget. Lo cuma cukup dan mungkin jadi berat karena UKT lo tinggi. Terus pas lo berprestasi dan ingin cari beasiswa ada? Syarat beasiswa mah miskin,1.78603E+18,,Zuherooo,in,In Your Eyes,0,1,0,https://x.com/Zuherooo/status/1786032503956045862,169853602,Zuherooo
1.78601E+18,Thu May 02 12:48:09 +0000 2024,0,Maraknya KIP-Kuliah yang dipake orang-orang beruang dan banyak masyarakat yang benar-benar tidak mampu membayar uang kuliahnya karena UKT yang tinggi. Salah satu bukti bahwa birokrasi pendidikan tinggi kita tidak berjalan dengan baik. Berharap sekali Indonesia bisa kuliah gratis,1.78601E+18,,,in,,0,0,0,https://x.com/fikridinegoro/status/1786014814843949234,1.50118E+18,fikridinegoro
1.78592E+18,Thu May 02 06:33:43 +0000 2024,0,Banyak kampus yg buka fak kedokteran beberapa program di bbrp fak mulai nerima maba satu tahun 2x periode uang pangkal dan UKT naik jauh Ini semua mulainya dr keputusan ptnbh ga si? Udh jd ladang bisnis bukan pendidikan yg keadilan sosial bg seluruh rakyat indonesia lagi kah,1.78592E+18,,,in,"Yogyakarta, Indonesia",0,0,0,https://x.com/iseeuu__/status/1785920585769562139,1442735323,iseeuu__
1.78591E+18,Thu May 02 05:55:21 +0000 2024,1,Persoalan ini nggak hanya melanda pendidikan umum aja. Jenjang pendidikan perguruan tinggi juga lagi dilema karena persoalan Uang Kuliah Tunggal (UKT) yang naik di beberapa kampus Indonesia diantaranya ada UIN Jakarta dan Universitas Jenderal Soedirman Purwokerto.,1.78591E+18,,DNK_TV,in,Gd. Fdikom Lt.3 UIN Jakarta,0,1,0,https://x.com/DNK_TV/status/1785910930729255106,599155034,DNK_TV
1.78518E+18,Thu May 02 03:50:54 +0000 2024,4,@Mdy_Asmara1701 Anggaran Pendidikan Naik UKT juga Naik ini Rezim @jokowi bisa kerja gak sih? Indonesia Aneh sejak @jokowi jadi Presiden.,1.78588E+18,,Mdy_Asmara1701,in,"Bogor, West Java",0,0,0,https://x.com/RFauzy5/status/1785879612331069565,3236618732,RFauzy5
1.78587E+18,Thu May 02 03:32:20 +0000 2024,5,Lihat berita. Ribut-ribut KIPK dan kenaikan UKT di Hari Pendidikan Nasional. Walaupun emang lagi ga baik-baik saja smoga dunia Pendidikan Indonesia bisa berbenah dan lebih baik lagi.,1.78587E+18,,,in,,0,0,1,https://x.com/Isra_KK/status/1785874942770487352,146312654,Isra_KK
1.78555E+18,Wed May 01 05:56:10 +0000 2024,67,@tanyakanrl Mau Indonesia emas katanya tapi akses pendidikan malah makin sulit orang mampu sekalipun juga engap ukt segitu,1.78555E+18,,tanyakanrl,in,,0,0,5,https://x.com/jwinbestie/status/1785548748338372782,1.45442E+18,jwinbestie
1.78552E+18,Wed May 01 03:49:50 +0000 2024,3,Panggilan darurat (Mayday) memang butuh digaungkan bagi dunia pendidikan Indonesia. - Gaji @pekerjakampus rendah - UKT mahal - Nepotisme dalam rekrutmen Semua bisa ditelusuri ke kondisi saat kontrol hanya dipegang sebagian elit pendidikan. #MayDay2024 #SerikatPekerjaKampus,1.78552E+18,,,in,,0,0,0,https://x.com/ajiehatadji/status/1785516958760542214,90800543,ajiehatadji
